{
  "schema": "music-studies/performance-rig/v1",
  "kind": "rig-profile",
  "id": "synth-programmer-synthv1",
  "display_name": "Synth Programmer (synthv1 Candidate)",
  "description": "S2 candidate synthesizer layout using synthv1 ordinary LV2 ControlPorts; not present in the protected Airstar binding.",
  "device_profiles": {
    "arturia-main": "synth-programmer-synthv1",
    "smk25-main": "ambient-pad-layers",
    "smc-mixer-main": "eight-band-eq",
    "smc-pad-main": "drum-set",
    "smc-pad-pocket": "drum-set"
  },
  "readiness": "control-only",
  "takeover_policy": {"default": "ignore-until-moved", "volume": "pickup"},
  "state_policy": "persist",
  "required_capabilities": [
    "control.master-mute",
    "control.pad-layer-latch",
    "control.pad-layer-transport",
    "effect.equalizer.eight-band",
    "midi.control-input",
    "midi.performance-input",
    "midi.transport-input",
    "notes.ambient-pad-layers",
    "notes.drum-set",
    "notes.layered-instruments",
    "parameter.drum-set-output-gain",
    "parameter.drum-set-volume",
    "parameter.equalizer.band-gain",
    "parameter.layer-reverb",
    "parameter.layer-volume",
    "parameter.master-volume",
    "parameter.pad-layer-volume"
  ],
  "ownership": [],
  "preparation": {
    "pinned_capabilities": [
      "engine.synthv1",
      "engine.drum-set",
      "engine.smk.cloud-shimmer",
      "engine.smk.hillsong-pad",
      "engine.smk.magic-ambient",
      "engine.smk.majesty-pad",
      "engine.smk.oceans-worship-pad",
      "engine.smk.sanctorium-pad",
      "engine.smk.warm-worship-pad",
      "engine.smk.worship-shimmer"
    ]
  },
  "shared_resources": {
    "engines": ["engine.drum-set"],
    "effects": ["effect.master.instrument-mixer", "effect.pad.sustain-scale"],
    "routes": []
  },
  "switch_safety": {"on_failure": "retain-active", "rollback": "required", "transition": "preserve"}
}
